会社名,資本金,売上高,代表者,ホームページ,メールアドレス,連絡先
株式会社ＳＲＣ,1000万円（グループ合計4億82万円※資本準備金含む）,,"横山　剛（よこやま　たけし）  昭和40年9月2日生　趣味はラグビー（未だ現役）、他スポーツ観戦 甲南大学文学部卒　神戸大学大学院修了　経営学修士（MBA) 神戸大学大学院　経営学研究科　博士課程後期（Ph.D.）在学中 　 神戸大学、流通科学大学、神戸学院大学等で客員教授、非常勤講師を歴任 2017年4月より、近畿大学、神戸芸術工科大学、流通科学大学にて客員教授、非常勤講師を行う座右の銘は、「人間万事塞翁が馬」　尊敬する人は冒険家、故植村直己さん ブログ http://blog.src-japan.net/ Face book http://www.facebook.com/takeshi.j.yokoyama twitter https://twitter.com/Take_Yokoyama",,,〒650-0021兵庫県神戸市中央区三宮町2-7-4神戸日興ビル7ＦTEL：078-393-3077担当/新卒採用係
株式会社スーパー大栄,1億円,175億円（2017年2月実績）,"代表取締役社長　松島 三秋",,,"株式会社スーパー大栄〒807-0823　北九州市八幡西区中須1-1-7TEL.：093-602-4689 （人事直通）採用担当：井上・小山"
"株式会社 中日販売研修センター",1000万円,31億6859万円（2016年実績）,"代表取締役　古田 博史",,,中日新聞社　販売局　中日販売研修センター販売促進部　採用担当〒460-8511　名古屋市中区三の丸1-6-1TEL　052-221-0963
コールテック株式会社,1000万円,6億45百万円（2016年9月度決算）,代表取締役　小幡早苗,,,コールテック株式会社〒981-1105宮城県仙台市太白区西中田7丁目10-8担当　小幡　浩司TEL：022-306-3235
中部オプチカル株式会社,1000万円,47.7億円（H29.2月決算）,竹内　詮吉,,takeda@megane-akafudado.com,中部オプチカル株式会社総務部/武田　芳明〒480-0102　愛知県丹羽郡扶桑町高雄字伊勢帰97TEL：0587-93-8120Mail：takeda@megane-akafudado.com
株式会社ツルハグループドラッグ＆ファーマシー西日本,2億8750万円,782億円（2015年5月期実績）540億円（2014年3月期実績）511億円(2013年3月期実績)497億円(2012年3月期実績)478億円(2011年3月期実績)471億円(2010年3月期実績),代表取締役会長　木嶋　敬介代表取締役社長　村上　正一,http://www.tsuruha-hd.co.jp,tgnjinji@tgn.tsuruha-gr.jp,"株式会社ツルハグループドラッグ＆ファーマシー西日本 〒733-0841 広島市西区井口明神1-1-10 【全学部・全学科対象】担当：浦田(ウラタ)、大元（オオモト）、永安（ナガヤス） TEL:0120-871-715 Email:tgnjinji@tgn.tsuruha-gr.jp【薬学部対象】担当：吉田(ヨシダ)、末田（スエダ）、杉本(スギモト)TEL:0120-871-715 Email:tgnjinji@tgn.tsuruha-gr.jpHP:http://www.tsuruha-hd.co.jp/drag_and_pharmacy_west"
株式会社ベルジョイス,10億5227万円,772億円　（2016年2月末現在）,"代表取締役名誉会長兼ＣＥＯ　遠藤　須美夫代表取締役会長　　　　　　　　 小苅米 秀樹 代表取締役社長　　　　　　　　　澤田　司",,,株式会社ベルジョイス〒020-8567　盛岡市羽場10-100-3採用フリーダイヤル：0120-935-956ＴＥＬ　019-614-0318saiyou-tyuto@jois.co.jp人事部　採用担当　小倉、圓子（まるこ）
有限会社モーターハウス　アサノ,1500万円,2億8000万円（2017年3月期）,代表取締役　浅野公一郎,,,"有限会社モーターハウス　アサノ 〒132-0024　東京都江戸川区一之江3-24-3 新卒採用担当　浅野TEL 03-3656-2657 ※お問い合わせは、ホームページの「お問い合わせフォーム」より連絡ください。"
株式会社マミーマート,26億6020万円,1010億1300万円（2016年9月決算　連結）,代表取締役社長　岩崎裕文,,saiyou@mammymart.co.jp,〒331-0812埼玉県さいたま市北区宮原町2-44-1(株)マミーマート　人事部　谷部TEL:048-654-2513（直）MAIL:saiyou@mammymart.co.jp※会社説明会および第一〜三次選考の参加に関するお問い合わせは、下記専用番号にお願いいたします。TEL:0120-106-769（フリーダイヤル）
株式会社アィ・シィ・ピー,4400万円,16億877万円（2017年3月実績）,代表取締役社長　豊泉　未知洋,,,株式会社アィ・シィ・ピー採用担当宛〒921-8803石川県野々市市押越2-49-1TEL：076-248-2221
ヒビノメディアテクニカル株式会社,3500万円,24億6000万円（2015年度）,代表取締役社長　中島　義人,http://www.media-t.co.jp/,recruit@media-t.co.jp,"ヒビノメディアテクニカル株式会社〒135-0062東京都江東区東雲2-9-23管理部　採用担当TEL：03-6457-2063E-mail: recruit@media-t.co.jpURL: http://www.media-t.co.jp/"
株式会社木谷仏壇,5600万円,20億円（2015年4月期実績）,代表取締役会長　岡本博文,,,■■■　株式会社　木谷仏壇　丸亀本店■■■　香川県丸亀市田村町1268■■■　TEL:0877-23-6767■■■　Network：高松/綾川/丸亀/善通寺/観音寺/三豊高瀬/三島川之江/新居浜/今治新卒採用に関する質問は【岡本】までご連絡下さい。
マサニ電気株式会社,3000万円,24億円（2014年5月期実績）25億円（2015年5月期実績）35億円（2016年5月期実績）,"代表取締役　富士元 克敏",,,"本社／人事採用担当〒650-0022 兵庫県神戸市中央区元町通1-6-12 元町スタービル3ＦTEL：078-333-3810"
"株式会社ジン デザイン ジャパン",1460万円,"5億円(2017年3月期実績) ","代表取締役　寺澤　勇一郎 ＊今年46歳。社員達に負けない位、勢いがあって活動的！ ＊ブログも毎日更新しています！　＜ブログ＞http://www.jin-design.jp/msg/",,,"株式会社フォース 新卒採用チーム＜立川本社＞ 〒190-0012東京都立川市曙町2-9-1　菊屋ビル9FＴＥＬ/042-540-7971　　ＦＡＸ/042-540-7972新卒採用担当迄"
ニコル・カーズ合同会社,9780万円,非公開,"CEO　C.H. 二コ ローレケ",http://www.nicole-bmw.co.jp/jp/nicole-bmw/ja/index.html,,"ニコル・カーズ合同会社〒212-0005 神奈川県川崎市幸区戸手2-5-7人事部・採用担当　永井TEL：044-272-5523"
株式会社ジョブエックス,1000万円,7億1900万円（平成27年度実績）,代表取締役　山下達也,,okamoto@jobx.co.jp,〒107-0051東京都港区元赤坂１−１−１６　東京元赤坂ビル５F交通：東京メトロ銀座線・丸の内線「赤坂見附駅」B3出口より徒歩3分TEL：０３（６４４７）５６１５E-mail：okamoto@jobx.co.jp
トライアルグループ,21億2335万300円（トライアルカンパニー）,"3639億円 （2016年3月　グループ連結）● 10年で約3倍の成長を遂げました！● 2026年までに3兆円企業を目指します！",代表取締役社長　楢木野　仁司,http://www.trial-net.co.jp,recruit@trial-net.co.jp,〒813-0034　福岡県福岡市東区多の津1-12-2株式会社トライアルグループ人事部新卒採用課　TEL　092-626-5550HP　http://www.trial-net.co.jpMAIL　recruit@trial-net.co.jp※お問い合わせの受付は株式会社トライアルグループで行っております。
株式会社あとらす二十一【制作専門コース≪Webデザイナー・Webプロデューサー・フロントエンジニア職≫】,1億円,,代表取締役　井上恒郎,http://at21.jp,jinji@at21.jp,"〒163-0428東京都新宿区西新宿2-1-1新宿三井ビル28F株式会社あとらす二十一担当/人事部　採用担当【TEL】 　 03-6832-2121（代表）　【MAIL】 jinji@at21.jp【URL】　　http://at21.jp/"
株式会社くすりの福太郎,9800万円,"　　　　　売上高　　　-------------------2017年 5月　　622億円2016年 5月　　611億円2015年 5月　　566億円2014年 5月　　523億円2013年 5月　　477億円2012年 5月　　446億円2011年 5月　　421億円　2010年 5月　　386億円2009年 5月　　363億円2008年 5月　　350億円　　",代表取締役社長　小川　久哉,http://www.kusurinofukutaro.co.jp,saiyo-fukutaro@tsuruha.co.jp,"〒273-0107　千葉県鎌ケ谷市新鎌ケ谷2-8-17　新鎌ケ谷Fタワー8F人材採用部　進藤・山路・森本・関口TEL:047-444-4129E-MAIL:saiyo-fukutaro@tsuruha.co.jpＵＲＬ　http://www.kusurinofukutaro.co.jp/交通機関 東武アーバンパークライン(旧：東武野田線) 新京成線 北総公団線 「新鎌ヶ谷駅」 徒歩4分"
有限会社　岩見商事,1000万,44300万円（2017年5月実績）,代表取締役　多田　昭文,http://www.yuagari-honpo.jp,u-iwami@coffee.ocn.ne.jp,"有限会社　岩見商事　担当/多田住所：〒874-0931　大分県別府市西野口町6-5TEL:0977-25-3353 　FAX:0977-25-3373Mail:u-iwami@coffee.ocn.ne.jp"
小田安全硝子株式会社,20000000円,1500000円（金額単位1000円）（平成28年度）,"代表取締役 山田 昭二郎",http://www.odasg.co.jp/,,"小田安全硝子株式会社住所：〒670-0824 兵庫県姫路市京町1丁目62TEL：0792-84-6200（代）　FAX：0792-84-7770"
"株式会社 ホンダクリオ上尾",2500万円,57億円（平成28年3月期）,"代表取締役社長　江川 甲子雄",http://www.hondacars-okegawa.co.jp/,,"株式会社 ホンダクリオ上尾〒363-0008　埼玉県桶川市坂田1633-1TEL：048-775-2774　FAX：048-775-3081m-fuku.cst03@honda-auto.ne.jp"
株式会社アイアイイスズHD,1000万円,グループ全体　３０億円,代表取締役　飯間康行,,mitsuno@eye-eye-isuzu.co.jp,"株式会社アイアイイスズHD〒761-8075香川県高松市多肥下町1523-1電話番号 087-864-5225　E-mail mitsuno@eye-eye-isuzu.co.jp担当者　満野・小西"
株式会社アイエー,3億円,211億円　※2016年3月期,"代表取締役社長　小熊 孝",,iasaiyou@i-a.co.jp,株式会社アイエー〒244-0801神奈川県横浜市戸塚区品濃町545-5TEL:045-821-7500（本社）メール：iasaiyou@i-a.co.jp採用窓口／アイエーグループ株式会社　辻田・井東
株式会社MONARIOキャピタルフーズ,55万円,1億7000万円,代表取締役　高田　智徳,http://www.monario.jp/,,株式会社MONARIOキャピタルフーズ〒869-5442熊本県芦北郡芦北町花岡309-54採用担当TEL：0966-82-2033
株式会社八広社,2000万円,16億4117万円(2016年度実績)グループ総取扱高／69億2743万円(2016年度実績),小浜　真有美,,hakkosya@ii-jinji.com,八広社　採用担当E-mail：hakkosya@ii-jinji.comTEL:03-3839-5021〒110-0016東京都台東区台東3-42-7　松田商事ビル3Ｆ
KeePer技研株式会社,"13億4516万円 (2017年6月末 現在)",69億9935万円(2017年6月期),代表取締役社長　谷好通,http://www.keepercoating.jp,,"KeePer技研株式会社●http://www.keepercoating.jp/corp/company/●saiyo@itacgiken.co.jp【東日本採用窓口】東京都葛飾区西新小岩5-26-12TEL:03-5654-1018東日本支社　採用担当　岩崎・小川【西日本採用窓口】愛知県大府市吉川町4-17 TEL:0562-45-5258西日本支社　採用担当　岩崎・水谷"
株式会社ジャパンエディターズユニオン,1000万円,4億円(2016年度実績),代表取締役　野口道夫,,,"株式会社ジャパンエディターズユニオン〒107-0052 東京都港区赤坂3-13-3 赤坂セントラルビル4FTEL：03-3505-7513FAX：03-5570-7406採用担当R係"
高橋自動車株式会社,1000万円,非公開,高橋　光晴,http://takahashi-car.com/,,"高橋自動車株式会社〒369-0306埼玉県児玉郡上里町七本木2913-2採用担当　高橋 幸雄又は相川TEL:0495-33-2048"
株式会社クラリシオン,3000万,2億円,代表取締役　柴田猛司,,,株式会社クラリシオン〒107-0052　東京都港区赤坂7-6-9　赤坂ONビル301採用担当　柴田猛司TEL：03-3585-0093
株式会社アイキューブ・マーケティング,300万円,8億4800万円（2016年10月期実績）,"代表取締役社長　岩上 直也",http://icube-m.com/index.html,,株式会社アイキューブ・マーケティング〒105-0022東京都港区海岸2丁目1-18　高丸ビル7階採用担当TEL：03-3453-4252
株式会社市川自動車,2000万円,7.5億円（2017年6月期）,"代表取締役 市川 哲也",http://ichikawa-group.com,,(株)　市川自動車〒424-0944　静岡市清水区築地町10-10マツダオートザム清水2Ｆ　総務　曽根邦光ＴＥＬ：054-368-4376■URLhttp://ichikawa-group.com■E-mailk-sone@ichikawa-group.com
株式会社東邦プラン,5000万円,約9億4千万円（27期実績）,代表取締役　本多修,http://www.tohoplan.co.jp,jinji@tohoplan.co.jp,"株式会社東邦プラン〒212-0027 神奈川県川崎市幸区新塚越201 ルリエ新川崎7F採用担当TEL：044-549-0772E-mail：jinji@tohoplan.co.jp"
大黒天物産株式会社,16億7900万円（2017年5月末）,"毎年105％以上の成長率を実現。実際に業界トップクラスの成長を続けてきました。今後更にスピードを加速し、日本一の企業を目指します。1553億円（2017年5月期） ※　対前年比 　107％1451億円（2016年5月期） ※　対前年比 　109％1331億円（2015年5月期）　　※　対前年比　106％1248億円（2014年5月期）　　※　対前年比　108％1146億円（2013年5月期）　　※　対前年比　117％　976億円（2012年5月期）　　※　対前年比　109％　893億円（2011年5月期）　　※　対前年比　112％　797億円（2010年5月期）　　※　対前年比　109％　730億円（2009年5月期）　　※　対前年比 114％ 　641億円（2008年5月期）　　※　対前年比　122％　523億円（2007年5月期）　　※　対前年比　128％　407億円（2006年5月期）　　※　対前年比　139％",代表取締役社長　大賀　昭司,http://www.e-dkt.co.jp,jinzai@e-dkt.co.jp,"岡山県倉敷市堀南704-5　〒710-0841(直)086-486-5490　(代)086-435-1100担当:人事部新卒採用課　大賀・角島・秋山■会社概要　　　　　　URL http://www.e-dkt.co.jp■E-mailアドレス　　　jinzai@e-dkt.co.jp"
株式会社エフ・シー・エス,5000万円,"28億4500万円 （移動体通信事業のみ）※2016年3月期実績","代表取締役　 金丸 まゆ",http://docom,,"株式会社エフ・シー・エス〒992-0012山形県米沢市金池5-1-27担当／新卒採用担当　土田、佐藤電話／0238-23-8606 （受付時間／9:45〜18:45）【本社アクセス】JR線「米沢駅」より徒歩23分【ホームページ】http://docomo-fcs.com （弊社運営店舗の雰囲気をお伝えしているサイトです。ぜひご覧ください。）http://www.fcs-k.com （弊社公式HP）"
株式会社スポプレ,8000万円,25億円（2016年6月実績）,"西岡　保之【略歴】1975年 岡山県生まれ。慶應義塾大学経済学部卒業後、2001年に株式会社ニッポン放送に入社。編成部、イベント開発部、制作部の3部署に所属。その後、株式会社サイバーエージェントに転職。アフィリエイトメディア、ターゲティングメディアの事業責任者を務める。2005年12月に株式会社スポプレを創業、代表取締役に就任。",,,株式会社スポプレ　採用担当〒107-6023東京都港区赤坂1-12-32アーク森ビル23階TEL：03-6435-5586
株式会社江崎新聞店,3000万円,33億円（2015年実績）,代表取締役社長　江崎和明,http://www.ezakinet.co.jp,k_mochizuki@ezknet.com,"〒420-0035　静岡県静岡市葵区七間町8-20　電話番号 054-255-2231 E-mail k_mochizuki@ezknet.comHP http://www.ezakinet.co.jp 担当：望月"
株式会社ブレイク・フィールド社,2410万円,"売上推移平成25年3月 17億5000万円平成26年3月 30億円平成27年3月 37億円","代表取締役　井田 正幸",,,"株式会社ブレイク・フィールド社東京都千代田区一番町7-1　一番町ビルヂング4階当社の採用活動はすべて下記の窓口で代行しております。 ご不明な点などがございましたら、以下の電話番号へご連絡ください。 ブラッシュアップ・ジャパン(株）ブレイク・フィールド社新卒採用担当者「櫻庭（サクラバ）」もしくは「下稲葉（シモイナバ）」をお呼びください。 TEL：03-5206-1369"
株式会社テーオーホールディングス,17億7564万円（2016年5月期）,400億2100万円（2016年5月期）,代表取締役社長　小笠原　康正,,,〒041-8610函館市港町3丁目18番15号株式会社テーオーホールディングス人事部　西田電話　：0138-45-3911
生活協同組合コープこうべ,,,,http://www.kobe.coop.or.jp,cksaiyou@kobe.coop.or.jp,"生活協同組合コープこうべ 神戸市東灘区住吉本町1丁目3番19号　〒658-8555ＴＥＬ：078-856-1321 E-mail：cksaiyou@kobe.coop.or.jp URL：http://www.kobe.coop.or.jp/担当：組織管理部　人事・労政　権藤（ゴンドウ）、山村（ヤマムラ）アクセス：ＪＲ「住吉駅」（ＪＲ神戸線・快速停車駅）下車、北出口すぐ"
株式会社ＤＮＳ,5000万円,81億9000万円（2016年11月実績）,,http://dns-jp,,"＝＝＝＝＝＝＝＝＝＝＝＝＝＝＝＝株式会社ＤＮＳ住所：〒862-0930熊本県熊本市東区若葉一丁目2-1TEL：096-331-5000採用担当：松田 URL http://dns-jp.co.jp/E-mail://matsuda@dns-jp.co.jp＝＝＝＝＝＝＝＝＝＝＝＝＝＝＝＝"
株式会社アクセスブリッジ,3000万円,"286 億526万円（平成 25 年3月実績）",,,,"【大阪本社】〒541-0053 大阪府大阪市中央区本町1丁目4-8　エスリードビル本町4F 【東京支社】〒171-0022東京都豊島区南池袋3-13-5　光3号ビル7F採用総合窓口：0120-941-464 担当：橋本■大阪本社へのアクセス　地下鉄堺筋線「堺筋本町」駅　12番出口徒歩約5分 　地下鉄中央線「堺筋本町」駅　1番出口徒歩約5分 ※向かいに東警察署・隣にドトールコーヒーがあります。 　1階に永和信用金庫が入っている白いビルです。■東京本社へのアクセス　池袋東口より徒歩7分。　明光義塾さん隣接のビルです。"
株式会社求人ジャーナル,2500万円,105億1500万円（2014年6月実績）,,https://www.journal.co.jp,,♪〜♪〜♪〜♪〜♪〜♪〜♪〜♪〜♪〜♪〜♪〜♪〜♪　　　　株式会社求人ジャーナル　人事課　　　　〒370-0841　群馬県高崎市栄町3-26　　　TEL：027-353-7062　採用担当　　　HP：https://www.journal.co.jp/♪〜♪〜♪〜♪〜♪〜♪〜♪〜♪〜♪〜♪〜♪〜♪〜♪
株式会社大平薬局,1000万円,4億4000万円（2016年03月現在）,小山平太郎,http://daihei.jp,info@daihei.jp,"株式会社大平薬局〒421-0523 静岡県牧之原市波津3-28採用担当：小山靖広TEL：0548-52-0007E-mail：info@daihei.jp"
広島中央ヤクルト販売株式会社,3300万円,18.4億円(平成28年度実績),代表取締役会長　永田徳博,http://www.hiroshimachuo-yakult.co.jp/,hitoshi_yamamoto@hiroshimachuo-yakult.co.jp,広島中央ヤクルト販売株式会社〒737-0911　広島県呉市焼山北3丁目2-8　担当／総務部　山本　人史TEL：0120-645-540E-mail：hitoshi_yamamoto@hiroshimachuo-yakult.co.jp
株式会社通信館,1400万円,19年度　　9億5000万円20年度　　9億8000万円21年度　　9億6100万円22年度　10億3500万円23年度　12億3000万円24年度　13億7900万円25年度　14億6900万円26年度　16億600万円27年度　17億1200万円28年度　18億4400万円,竹永淳一,,,"＝＝＝＝＝＝＝＝＝＝＝＝＝＝ 株式会社通信館 熊本県八代市大手町１丁目6-27 TEL:0965-33-9300　 ＝＝＝＝＝＝＝＝＝＝＝＝＝＝＝"
日立造船因島生活協同組合,3億9816万円,25億円（2017年3月実績）,理事長　神野　孝光,http://www.innoshima-seikyo.com/,,日立造船因島生活協同組合〒722-2324広島県尾道市因島田熊町4508-1総務部　採用担当　藤井孝司TEL：0845-22-2560
株式会社コモディイイダ,,,,,,東京都北区滝野川7-27-7　〒114-8501人事部採用チーム　会沢　陽之介　児玉　雄介　渡邉哲也TEL　03-3916-1111
スーパーヤオスズ株式会社,2000万円,25億円,,,,愛知県刈谷市高津波町4-5040566-24-0387スーパーヤオスズ株式会社　総務部　丹羽加奈恵
株式会社オートセンター・イグチ,1000万円,37億円（2016年3月期）36億9.000万円（2015年3月期）,井口　清三,,,株式会社オートセンター・イグチ　東京都杉並区井草5-1-10TEL：03-3396-3171　FAX：03-3396-0794
有限会社永井商會,1000万円,14億9517万円（2015年5月決算）,永井　健之,,,【採用担当】重見和弘/石崎亜梨沙/伊藤明美【連絡先】〒792-0812愛媛県新居浜市坂井町2丁目3-8フジ新居浜駅前内auショップフジ新居浜駅前重見　宛TEL：0897-34-2377
ソフトバンク株式会社,"1772億5100万円 （※2016年度）",8兆9010億円（※ソフトバンクグループ全社の連結売上高　2016年度）,"代表取締役会長　孫 正義代表取締役社長兼 CEO　宮内 謙",http://crew.recruit.softbank.jp,,"------------------------------------------------------------ソフトバンク クルー採用担当　東京都港区東新橋1-9-1　東京汐留ビルディング　URL：http://crew.recruit.softbank.jp/sales/-----------------------------------------------------------"
株式会社ライフコーポレーション,"１００億４００万円 ","２０１０年２月期／４６８８億５８００万円 （前期比１０１.２％）２０１１年２月期／４８０８億２２００万円 （前期比１０２.６％）２０１２年２月期／５０３１億　 ７００万円 （前期比１０４.６％）２０１３年２月期／５２０３億８５００万円 （前期比１０３.４％）２０１４年２月期／５３５５億１７００万円 （前期比１０２.９％）２０１５年２月期／５８５７億７０００万円 （前期比１０９.４％）２０１６年２月期／６２９９億８６００万円 （前期比１０７.５％）２０１７年２月期／６５２７億８４００万円 （前期比１０３.６％）","代表取締役会長兼ＣＥＯ　清水 信次（しみず のぶつぐ）代表取締役社長兼ＣＯＯ　岩崎 高治（いわさき たかはる）",http://www.lifecorp.jp,shutoken.saiyou@lifecorp.co.jp,東京本社／首都圏人事部／〒110-0016　東京都台東区台東1-2-16TEL:03-3837-5264Ｅ-mail：shutoken.saiyou@lifecorp.co.jp大阪本社／近畿圏人事部／〒533-8558　大阪市淀川区西宮原2-2-22TEL:06-6150-6168Ｅ-mail：life.k.saiyou@lifecorp.co.jpホームページアドレス　http://www.lifecorp.jp/
株式会社サンシャインチェーン本部,1億円,223億円(2016年3月期実績),代表取締役会長　川崎博道　　　代表取締役社長　桑名俊二,http://recruit.sunshinechain.com,,"〒780-0814　高知県高知市稲荷町11-45 TEL 088-882-4711　FAX　088-882-4722 recruit@sunshinechain.co.jp 人事担当　大菊・大崎サンシャインHP　http://recruit.sunshinechain.com/"
日本ビジネスアート株式会社,5000万円,"22億円 (2016年3月期)　※無借金経営",代表取締役社長　高下京三,http://www.jbakk.co.jp,jba-t-saiyo@jbakk.co.jp,"【東京採用】 東京本社：〒105-6109　　　　　　東京都港区浜松町2丁目4番1号 世界貿易センタービルディング9階　　　　　　□TEL:03-5408-5101（代表） 　/採用担当　　　　　　□MAIL:jba-t-saiyo@jbakk.co.jp 【大阪採用】 大阪本社：〒541-0052 　　　　　　大阪府大阪市中央区安土町2-3-13　大阪国際ビルディング15階 　　　　　　□TEL:06-6261-1010 /採用担当  □MAIL:jba-t-saiyo@jbakk.co.jp ■ホームページ：http://www.jbakk.co.jp ■新卒採用ホームページ：https://www.jbakk.co.jp/recruit_2018/"
北日本自動車株式会社,1200万円,１億７千万円,代表取締役　高野憲治,http://www.lotas-ishikawa.jp/shop_list/shop25.html,,北日本自動車株式会社〒927-0031石川県鳳珠郡穴水町鵜島ニ22採用担当TEL：0768-52-1313FAX：0768-52-1315
株式会社　松葉,7000万円,24億円/2016年実績,"松葉 将登",,,大阪市西区北堀江2丁目16番18号　松葉ビル株式会社松葉ＴＥＬ／06-6536-2877（人事部部長　横山）
株式会社スーパー丸幸,1000万円,20億円（2016年8月時点）,代表取締役　野村英樹,,,●○●○●○●○●○●○●○●　株式会社　スーパー丸幸　〒370-2316　群馬県富岡市富岡980　採用担当　TEL:0274-63-5898○●○●○●○●○●○●○●○
