会社名,資本金,売上高,代表者,ホームページ,メールアドレス,連絡先
株式会社グラム,１，０００万円,"□不況にも負けない！□安定成長を続けています！！１０５億２千百万円（平成２８年６期グループ実績）６４億１千万円（平成２７年６月期グループ実績）５３億７千百万円（平成２６年６月期グループ実績）４８億２千百万円(平成２５年６月期グループ実績)４６億２千百万円（平成２４年６月期グループ実績）３９億円（平成２３年６月期グループ実績）３８億４千万円（平成２２年６月期グループ実績）３３億８千７百万円（平成２１年６月期グループ実績） ３０億５千万円（平成２０年６月期グループ実績） ２５億６千万円（平成１９年６月期実績） ２３億円（平成１８年６月期実績）",中川　一光,http://ggwh.jp,recruit@gram-net.jp,(株)グラム　人事課〒157-0066　東京都世田谷区成城7-8-18リクルートダイヤル：03-5429-8191リクルートメール：recruit@gram-net.jphttp://ggwh.jp/index.html（株式会社G&Gワークスホールディングス）
株式会社ウエスト,1000万円,7億3000万円(2017年予定),代表取締役社長　市村　勉,,,"〒107-0062東京都港区南青山2-27-19　abcd青山ビル2F 　TEL：03-6825-6422（採用担当直通）"
東宝企業株式会社,1800万円,92億円（2016年実績）,代表取締役社長　宇崎孝也,http://www.tohokigyo.com,jinji@tohokigyo.com,鳥取県倉吉市大正町2丁目90番地TEL　0858-22-7321担当／穴口・山根E-mail　jinji@tohokigyo.com会社HP　http://www.tohokigyo.com/
株式会社飛竜企画,3000万円,14億2610万円（2015年3月実績）,下川徳雄（大学在学中に創業）,http://www.hiryu.co.jp,,●住所・電話番号・連絡先〒153-0063　東京都目黒区目黒2-11-11　HKビルTEL.03-3490-6121（人事部・採用担当）URL　http://www.hiryu.co.jp/●交通JR・東急・地下鉄目黒駅より徒歩13分目黒駅西口を出て目黒通りを直進、山手通りとの交差点を右折。
株式会社大和,1000万円,,"代表取締役　涌本 宜央",,,総務部　人事課　家永(いえなが)、別小(べっしょう)、木村〒564-0042　大阪府吹田市穂波町5-1（3階）06-6380-3338saiyo_01@daiwa-cycle.co.jp
兼松ＢＤコミュニケーションズ株式会社,9445万円,21.23億円（2017年3月期）,代表取締役社長　宮脇　大輔,,,"兼松ＢＤコミュニケーションズ株式会社〒830-0039福岡県久留米市花畑二丁目15-2TEL:0942-37-2772（フリーコール 0800-888-1477）採用担当"
株式会社チャーム,1000万円,129億円（2016年度）108億円（2015年度）98.6億円（2014年度）86.9億円（2013年度）75.3億円（2012年度）55.9億円（2011年度）44.2億円（2010年度）,"代表取締役　吉岡 晃",,,"株式会社チャーム 〒370-0603　群馬県邑楽郡邑楽町中野2819-8 TEL: 0276-88-0910 (代) 受付時間：平日 9:00-20:00 新卒採用担当係"
アークランドサカモト株式会社,64億6299万円,1030億3100万円（2017年2月期連結）,"代表取締役社長　坂本 雅俊",,,"〒955-8501 新潟県三条市上須頃445番地アークランドサカモト株式会社管理本部　総務部 人事採用グループ　石本TEL:0256-33-6042(フリーダイヤル)0120-350-634交通機関●上越新幹線「燕三条駅」下車、徒歩10分。北陸自動車道「三条燕IC」より車で5分"
つるや株式会社,9000万円,１９５億円（2016年7月期）,代表取締役社長　西村　理作,http://www.tsuruyagolf.co.jp,,大阪市中央区本町3丁目3-5　〒541-0053　電話　06-6281-0111（代）総務人事課／採用担当saiyo@tsuruyagolf.co.jphttp://www.tsuruyagolf.co.jp
株式会社ドミー,8億4154万円,353億2200万円(2016年5月実績)342億6700万円(2015年5月実績)338億5000万円(2014年5月実績)337億6000万円(2013年5月実績)336億1000万円(2012年5月実績)　※連結,代表取締役社長　梶川勇次,http://www.domy.co.jp,,株式会社ドミー〒444-0007愛知県岡崎市大平町字八ッ幡1-1TEL：0564-25-1121採用担当：総務部　人事課/成瀬HP：http://www.domy.co.jp/
株式会社アーズ,2000万円,非公開,代表取締役　西瀧順二,http://www.aahz.co.jp,,"〒135-0064東京都江東区青海２−７−4　theSOHO 307採用担当【交通】ゆりかもめ「船の科学館」または「テレコムセンター」駅より各徒歩5分【ＨＰ】http://www.aahz.co.jp/【お問い合わせ】saiyo@aahz.co.jp"
"株式会社ハヴァ ナイス トリップ",4000万円,30億900万円（2013年7月期実績）,山本秀一　（やまもと　ひでかず）,,,"〒651-0061 兵庫県神戸市中央区上筒井通3-2-5採用担当　宮永TEL：078-222-1631"
株式会社マツヤデンキ,1億円,221億40万円（2017年2月期実績）,"代表取締役社長　　瀧川　一隆 ",,,〒551-0031大阪府大阪市大正区泉尾3丁目11番14号(株)マツヤデンキ人事総務部　採用担当者TEL:06-6552-0720
ウッドオフィス株式会社,1000万円,26億円　※2015年度実績,"代表取締役社長　名取 禎",http://www.wo-gr.jp/w-o/,,ウッドオフィス株式会社　総務部　採用担当〒105-0004　東京都港区新橋5-26-5TEL：03-6402-1221/FAX：03-6402-1224
プラモ合同会社,900万円,2億0542万円(2016年9月),"松村 隆",,,プラモ合同会社〒107-0062　東京都港区南青山1-17-14　プレイム青山1階TEL/03-3402-0430　採用事務担当/前田、坂本
株式会社スーパーみらべる,1500万円,1100000万円　（平成28年7月期）,代表取締役　関根朋之,,mirabelle@saiyou-center.jp,"株式会社スーパーみらべる新卒採用担当 〒173-0004東京都板橋区板橋1-35-9　エムアイビル4FTEL：03-5943-3500　（管理部/大貫）MAIL：mirabelle@saiyou-center.jp"
株式会社ネプロクリエイト,50000000円,4173000000円（2016年3月31日時点）,"代表取締役社長　成瀬 誠",,nc-recruit@nepro.jp,"株式会社ネプロクリエイト採用担当　戸川　真絵（トガワ　マサエ）〒576-0041大阪府交野市私部西1-31-7TEL　090-5133-6576 (10時〜19時）MAIL nc-recruit@nepro.jp　※会社説明会の日程相談やご質問など、お気軽にご連絡ください。"
株式会社サクセス（携帯事業部・ショップスタッフ職）,7000万円,27億8400万円（2017年6月期）,代表取締役　和泉　享,http://www.kk-success.co.jp,soumu@kk-success.co.jp,"★☆★　株式会社サクセス　採用窓口　★☆★どんな小さな質問でも構いません。お気軽にお問い合わせください！〒760-0015香川県高松市紫雲町8-20TEL 050-3530-1006総務課／大西e-mail／soumu@kk-success.co.jpサクセスＨＰ／http://www.kk-success.co.jp/"
神奈川スバル株式会社,1億円,321億円（2015年3月）,"代表取締役社長　 飯山　勝久",http://www.kanagawa-subaru.com,,"神奈川スバル株式会社〒222-8571横浜市港北区新横浜1-18-1採用担当：総務部　総務・人事課／石川・永井TEL: 045-478-3625（直通）【ホームページ】http://www.kanagawa-subaru.com【本社アクセス】JR横浜線、市営地下鉄線「新横浜駅」より徒歩約10分※環状2号線を岸根方面へお進みください。屋上のスバルの看板が目印です。"
株式会社メディアトラスト,5500万円,"3億3800万円（2008年5月期実績） 5億4700万円（2009年6月期実績） 6億3400万円（2010年6月期実績） 6億4800万円（2011年6月期実績） 7億8100万円（2012年6月期実績） 7億8300万円（2013年6月期実績） 9億6400万円（2014年6月期実績）10億3500万円（2015年6月期実績）10億9600万円（2016年6月期実績）12億円（2017年6月期実績）『10期連続での増収記録を更新中！』","代表取締役　鬼頭 宏彰地元の流通業で6年勤務した後、学生時代からの車好きが高じて、1999年に中古車販売で独立起業。現在に至る。仕事もプライベートも何事も全力！そんな今も2年前に「学び」を思い立ち大学院に通う現役の”学生”でもあります。",,,"株式会社メディトラスト総務部 採用チーム　橋爪 琴美（はしづめ ことみ）【本社】〒465-0054愛知県名古屋市名東区高針台1-110TEL:052-734-3091　FAX:052-734-3092"
株式会社シュテルン三重,2000万円,,代表取締役　橋本　みどり,http://www.stern-mie.co.jp,,"株式会社シュテルン三重〒510-0885 三重県四日市市日永4-1-54059-340-6500／採用担当　千葉 HP：http://www.stern-mie.co.jp/"
モバイルシステム株式会社,100万円,10億5800万円　（2016年度実績）10億1600万円　（2015年度実績）10億5500万円　（2014年度実績）,"代表取締役　河村 朝尾",,,"モバイルシステム株式会社 愛知県西春日井郡豊山町豊場神戸115 0568-54-7218／採用担当まで"
スーパーサンシ株式会社,1億6188万円,250億円（スーパーサンシ株式会社）413億円（サンシグループ総計）※2016年度実績,代表取締役社長　植杉　好英,http://sanshi.jp,saiyou@sanshi.jp,"スーパーサンシ株式会社〒513-0806三重県鈴鹿市算所二丁目5番1号TEL：059-373-4034営業企画課　採用担当／坂倉 URL：http://sanshi.jp/ E-mail：saiyou@sanshi.jp"
株式会社万歳家具,1000万円,20億円,"川島 勉",http://www.mansaikagu.com/,,〒493-0002愛知県一宮市木曽川町門間字角田35株式会社万歳家具本社TEL：0586-87-0143担当者：後藤
株式会社メディアショップ古川,1000万円,205993154,代表取締役　角田健治,,,"株式会社メディアショップ古川〒989-6171宮城県大崎市古川北町2-2-41採用担当：人事／後藤TEL： 0229-24-6800"
株式会社ハローズ,31億1414万円,営業収益　1147億円(2017年2月期),代表取締役社長　佐藤　利行,http://www.halows.com,saiyou@halows.co.jp,〒701-0393岡山県都窪郡早島町早島3270番地1株式会社ハローズ本部　人事教育部採用担当：竹嶋・浅田・田島・西村・木村TEL：086-483-2782（直通）E-mail：saiyou@halows.co.jpURL：http://www.halows.comハローズ採用Facebook：http://www.facebook.com/halows.saiyou
株式会社ジェーソン,3億2030万円,,代表取締役社長兼会長　太田　万三彦,http://www.jason.co.jp,recruitjason@jason.co.jp,"株式会社ジェーソン〒277-0921　千葉県柏市大津ヶ丘2-8-5 採用担当／総務人事部　鈴木TEL: 04-7192-2040（直通）【メールアドレス】recruitjason@jason.co.jp【ホームページ】http://www.jason.co.jp/【本社アクセス】JR常磐線「柏駅」東口バス乗場（６）より、阪東バス「大津ヶ丘団地行」・「東我孫子車庫行」バス乗車（12分程）、「新中井」バス停にて下車、徒歩2分"
株式会社葉栗オートショップ,1000万円,10億9300万円(2017年3月実績)、10億1400万円(2016年3月実績)★2016年の年間販売台数は約1500台。軽自動車から輸入車まで幅広い取り扱いがあります。,代表取締役社長／梶川　幹生,,,"株式会社葉栗オートショップ愛知県一宮市木曽川町外割田伊勢田116 0586-87-5070／梶川"
株式会社デザイン,54000000円（2016年3月末現在　グループ総計）,25.5億円（2015年度）24億円(2014年度)19億円(2013年度),平林　義行,,saiyo@design-inc.jp,"〒163-0232 東京都新宿区西新宿2-6-1 新宿住友ビル32階 TEL : 03-6891-0508E-mail : saiyo@design-inc.jp"
エフコープ生活協同組合,,,"理事長　　 篠田 陽二（シノダ　ヨウジ）専務理事　堤 新吾（ツツミ　シンゴ）",http://www.fcoop.or.jp,,〒811-2495福岡県糟屋郡篠栗町大字篠栗4826-1エフコープ生活協同組合人事部　人財開発課　担当　岩田、井上ＴＥＬ：092-947-9002ＵＲＬ　http://www.fcoop.or.jp/アクセス　ＪＲ福北ゆたか線　「篠栗」駅より徒歩5分
株式会社エクストリンク,4678万円,132億1231万円（2017年4月度実績）105億728万円（2016年4月度実績）73億2069万円（2015年4月度実績）72億7450万円（2014年4月度実績）51億7699万円（2013年4月度実績）37億4115万円（2012年4月度実績）24億6300万円（2011年4月度実績）,代表取締役　廣瀬　雄一,http://www.extlink.co.jp,shinsotsu@extlink.co.jp,"≪大阪本社≫〒530-0057大阪市北区曽根崎2-3-5　梅新第一生命ビルディング16階【TEL】※お問い合わせは直通番号にお願いします。（直通）　06-7175-7130（代表）　06-6362-1371≪東京本社≫〒160-0022 　東京都新宿区新宿4-3-25　TOKYU REIT新宿ビル9F【TEL】※お問い合わせは直通番号にお願いします。（直通）　06-6362-4382（代表）　03-5362-3251【MAIL】shinsotsu@extlink.co.jp【URL】http://www.extlink.co.jp/recruiting/"
株式会社ナック,5000万円,84億7130万円（2015年3月期）,代表取締役社長　難波克年,http://www.i-nac.co.jp,,〒652-0806　神戸市兵庫区西柳原町4-8TEL:078-685-0085採用担当:近久(チカヒサ)、里見(サトミ)personnel@i-nac.co.jp◆URL　http://www.i-nac.co.jp/◆JR神戸線「兵庫駅」から徒歩5分
"株式会社 クロスメディア-アイ",200万円,8億3千万円(平成27年4月時点),倉富　真人,,,株式会社クロスメディア-アイ　auショップ大刀洗採用担当　福岡県三井郡大刀洗町鵜木1424-470942-77-1050
株式会社ベイビッシュハート,600万円,会社規定により非公開,"代表取締役　大崎　義宏これまでフリーランスのディレクターとして様々なバラエティ番組を企画・制作してきました。番組で欠かせないＡＤさんが、夢半ばで去っていく姿を見てきてＡＤさんの夢を叶える場が必要だと思い「ＢＡＢＹＩＳＨ ＨＥＡＲＴ」を立ち上げました。普通の制作会社と違い、ＡＤさん第一優先です！今後は、ＡＤさんの成長と共に会社も大きくしていければと考えています。",,recruit@babyishheart.com,"〒107-0052東京都港区赤坂7-6-15 赤坂ロイヤルビル308株式会社ベイビッシュハート　採用担当E-MAIL　recruit@babyishheart.comTEL　03-5572-7900 ※営業電話はご遠慮下さい"
"株式会社Class F",非公開,5000万円（2014年1月）,武市正尋,,,代表取締役武市　正尋090−1173−6481
株式会社ヨシヅヤ,2億6000万円,611億円（平成28年7月期実績）,伊藤彰浩+-That's　Yoshizuyaism.『社長からのメッセージ』---------+++競合他社に打ち勝ち、厳しい時代を生き残っていくためには、ハングリー精神がある人材の採用と、彼らの活躍が不可欠だと思う。素直でチャレンジ精神あふれる行動力のある同志に集って欲しい。+++--------------------------------+,http://www.yoshizuya.com,,〒496-8501愛知県津島市新開町1-6本社TEL:0567-23-7100採用事務局:052-218-6283　※学生の方用の窓口E-mail:recruit@yoshizuya.infoホームページURL:http://www.yoshizuya.com
株式会社エリアフォース,1000万円,34億7018万円（平成28年度実績）←34億3416万円（平成27年度実績）※グループ総取扱高／69億2743万円（平成28年度実績）←65億7993万円（平成27年度実績）,,,areajinji@tw-area.co.jp,"株式会社エリアフォース　新卒担当 MAIL：areajinji@tw-area.co.jp TEL：0120-999-179（平日10：00〜18：00） ＜総括本部＞〒110-0016 東京都台東区台東3-42-7　松田商事ビル4Ｆ　　　＜本　　　社＞〒330-0802埼玉県さいたま市大宮区宮町2-35　大宮ＭＴビル5Ｆ"
株式会社セレクション,3000万円,132億円（2017年3月度実績）,"代表取締役 山崎洋介",http://foods-selection.co.jp/index.html,,株式会社セレクション〒272-0132千葉県市川市湊新田1丁目6番8号新卒採用担当TEL：047-390-3336
イングホールディングス株式会社,2000万円,グループ総取扱高／69億2743円（2016年実績）,"代表取締役社長　森 義之",,,イングホールディングス株式会社　キャリア事業部〒110-0015　東京都台東区東上野1-14-4野村不動産上野ビル9階A03-6895-4134／キャリア事業部採用担当
株式会社相互移動通信,2億2000万円,56億円（平成28年3月期）,代表取締役　　池崎　正典,http://www.sougo-idou.co.jp,,"株式会社　相互移動通信〒921-8027石川県金沢市神田2-2-29　相互神田ビル076-280-0303URL: http://www.sougo-idou.co.jp/スマートフォンはこちら：http://www.sougo-idou.co.jp/sp"
株式会社タイヨー,3400万円,2017年9月期／995億円2016年9月期／944億円2015年9月期／879億円2014年9月期／821億円2013年9月期／771億円,"代表取締役社長　森田 剛",http://www.taiyo-otoku.com,,＝＝＝＝＝＝＝＝＝＝＝＝＝＝＝＝＝＝＝＝≪　株式会社タイヨー　≫〒314-0144　茨城県神栖市大野原4-7-1TEL：0299-77-7657　採用担当<HP>http://www.taiyo-otoku.com/index.php＝＝＝＝＝＝＝＝＝＝＝＝＝＝＝＝＝＝＝＝
兼松コミュニケーションズ株式会社,14億2500万円,"2017年3月期 129694百万円2016年3月期 139065百万円2015年3月期 133185百万円","代表取締役社長　菊地 孝",http://www.kcs.ne.jp,jinji@kcs.ne.jp,"┘┘┘┘┘┘┘┘┘┘┘┘┘┘┘┘┘┘┘人事部　新卒採用担当　〒151-8601　東京都渋谷区代々木3-22-7 新宿文化クイントビル3階ＴEL: 0120-77-2650 mail: jinji@kcs.ne.jpHP:http://www.kcs.ne.jp/┘┘┘┘┘┘┘┘┘┘┘┘┘┘┘┘┘┘┘"
株式会社パスポート,9900万円,320億円（2016年3月期実績）294億円（2015年3月期実績）264億円（2014年3月期実績）240億円（2013年3月期実績）209億円（2012年3月期実績）195億円（2011年3月期実績）178億円（2010年3月期実績）,濱田　総一郎,http://www.passport-net.co.jp,saiyou@passport-net.co.jp,"株式会社パスポート　人事部企画採用課〒216-0011　神奈川県川崎市宮前区犬蔵1-23-13人事総務部　企画採用課TEL:044-975-4800 E-mail saiyou@passport-net.co.jp（お問い合わせもお気軽に）当社ホームページ　http://www.passport-net.co.jp/ 田園都市線 宮前平駅 1番4番乗り場から生田行き、聖マリアンナ医大行き、鷲ヶ峰営業所行き乗車、菅生車庫下車、道路向かい。"
株式会社ベイシア,30億9950万円,2880億円(2014年2月実績)★設立当初（1997年）の売上高は750億円。,代表取締役社長　橋本浩英,http://www.beisia.co.jp,bs-saiyou@beisia.co.jp,群馬県前橋市亀里町900　〒379-2187　人事部採用グループ　TEL:027-210-0011　FAX:027-210-0118E-mail:　bs-saiyou@beisia.co.jphttp://www.beisia.co.jp/
株式会社フジテレコムズ,"8800万円 (授権資本１億1000万円)","・　73億円　　　　　（2017年3月末実績）・ 79億円 　　　　　（2016年3月末実績）・ 87億円　　　 　　（2015年3月末実績）・105億9800万円　（2014年3月末実績）・ 91億3100万円　（2013年3月末実績）・ 79億 100万円 （2012年3月末実績）・ 67億6400万円　（2011年3月末実績）※現在、関西を中心に20店舗開設していますが、今後も多数の出店を計画中。　また携帯電話販売市場だけでなく、グッズ販売などのショップ支援サービス、　携帯サイトビジネス、法人向けサービスにも力を入れ、より大きな事業拡大を目指しています。◆実質無借金経営の強固な経営基盤を築いています。",代表取締役社長　八川　徹,,,"株式会社フジテレコムズ〒542-0081 大阪市中央区南船場1−11−26　長堀フジビルTEL：06-6264-2226（直通）　本社総務・人事担当／坂元（サカモト）"
株式会社三徳,8800万円　※連結ベース1億5170万円,430億円(2015年2月期連結ベース),代表取締役社長　堀内　謙介,,santoku@access-t.co.jp,〒169-8550　東京都新宿区大久保2-1-1　人事部／新卒採用担当　Ｅメール　：santoku@access-t.co.jp　フリーダイヤル　：0120-07-3109
株式会社ワイズ,非公開,,代表取締役社長　山崎義文,,,株式会社ワイズ〒110-0016東京都台東区台東1-11-9　上西ビル3F採用担当TEL/03-5812-4351
株式会社一関ケーブルネットワーク,3億6800万円,3億704万円（平成28年6月実績）,"代表取締役　山岸 学",,icn-simizu_yu@icn-net.ne.jp,株式会社一関ケーブルネットワーク〒021-0871岩手県一関市八幡町1-24局長　清水祐喜TEL：0191-21-1256FAX：0191-21-2959E-mail：icn-simizu_yu@icn-net.ne.jp
株式会社ヤスサキ,1億1100万円（グループ合計）,235億円,"代表取締役会長　安崎 政士代表取締役社長　安崎 昌治",,,坪田・柳原まで☆TEL：0776-52-8111info@yasusaki.co.jp
株式会社コスモネット,"5億6600万円（うち資本剰余金 4億6600万円を含む）","　　　決算期　　　　　　売上高 ――――――――――――――――― 　2009年3月期　　222億9000万円 　2011年3月期　　355億5261万円 　2013年3月期　　646億7700万円 　2015年3月期　　728億6900万円　2016年3月期　　800億600万円(※グループ計)","代表取締役　三上 明",http://www.cosmonet.ne.jp,recruit-02@cosmonet.ne.jp,"【業務管理統括本部　人事グループ】 ■所在地：◎京都本社 ／京都市中京区烏丸通四条上る笋町689番地 TEL：075-212-3962◎東京本社／東京都港区新橋2-6-2 TEL：03-5157-1222■E-mail：recruit-02@cosmonet.ne.jp■URL http://www.cosmonet.ne.jp/ ご連絡はメールでいただきますようお願いいたします。"
株式会社魚喜,9億4103万円,（2017年2月期）売上高135億400万円（2016年2月期）売上高133億7900万円（2015年2月期）売上高135億900万円,代表取締役社長　有吉　喜文,http://www.uoki.co.jp/,saiyou_ukhy@uoki.co.jp,株式会社魚喜〒252-0804神奈川県藤沢市湘南台2-10-5人事課　採用担当TEL：0466-45-9859e-mail：saiyou_ukhy@uoki.co.jp
富士経済グループ（株式会社　富士経済/株式会社　富士キメラ総研）,2000万円,12億8300万円(2017年6月期),"株式会社 富士キメラ総研 代表取締役 田中一志",https://fk-m.co.jp,,"株式会社　富士経済〒103-0001東京都中央区日本橋小伝馬町1番５号　PMO日本橋江戸通電話　03-3664-5695採用担当/人事部　小田桐〒541-0043大阪市中央区高麗橋3-3-11　淀屋橋フレックスタワー電話　06-6228-2020（代）採用担当/大阪マーケティング本部　梅津株式会社　富士キメラ総研〒103-0001 東京都中央区日本橋小伝馬町1番５号　PMO日本橋江戸通電話　03-3664-5839採用担当/人事部　新卒係当社グループURL　https://fk-m.co.jpぜひ当社グループHPもご覧ください!"
株式会社オグラ,1億9000万円　（グループ合計）3500万円　（株式会社オグラ）,"グループ合計売上高　　 61.0億円(2015年2月期 南旺グループ実績)株式会社オグラ　　　　 　 41億円(2015年2月期)株式会社プラザアイ　　　 4億円(2015年2月期)",代表取締役社長　小倉　信典,http://www.ogura-megane.co.jp,saiyou@ogura-megane.co.jp,"南旺グループ【株式会社オグラ】管理本部人事課　　採用担当〒102-0093東京都千代田区平河町2-11-1　平河町ロンステート5F　電話：03-3263-6878FAX：03-3263-6899E-mail：saiyou@ogura-megane.co.jp URL：　http://www.ogura-megane.co.jp"
株式会社アクエス,1000万円,6億3000万円（2014年9月実績）,代表取締役　松本徹,http://www.accues.co.jp/,,株式会社アクエス〒670-0974　兵庫県姫路市飯田1-157採用担当　岡本TEL：079-233-5900
株式会社タケダ,1000万円,9億1000万円（2016年1月実績）,"代表取締役　武田 康裕",http://www.kitadoco.jp,saiyou@kitadoco.com,"◆・：・◆・：・◆・：・◆・：・◆・：・◆・：・◆・：・◆　〒760-0068　株式会社タケダ　香川県高松市松島町2丁目14-43　TEL: 087-868-6688　ＵＲＬ：http://www.kitadoco.jp/　Eメール：saiyou@kitadoco.com　採用担当：森・網谷◆・：・◆・：・◆・：・◆・：・◆・：・◆・：・◆・：・◆"
